uid;type;newspaper;language;title;title;content;content;size;date;year;issue;pages;nb_pages;is_on_front;country;persons_mentioned;locations_mentioned;access_right;content_provider;is_content_available;relevance;collections;[total:66,available:100]
DTT-1975-04-26-a-i0182;ar;DTT;de;Woche... v i- • . ¦•¦ ¦ - ¦ ..;Woche... v i- • . ¦•¦ ¦ - ¦ ..;Woche ... v i- • . ¦•¦ ¦ - ¦ . . Aufruf zum Fleischstreik Die Rechte der Auslandschweizer und Fleisch , wo ein Ueberangebot besteht , nur wenig zu < korrigieren . Kräftige Preiskorrekturen gab es indessen beim Ackerbau , die gleichzeitig das Ziel verfolgen , die Milchrechnung zu entlasten und durch eine grössere Ackerfläche den Grad der Selbstversorgung zu erhöhen . Ueber die Preisentscheide ist die Landwirtschaft nicht zufrieden . Nicht zufrieden ist auch « Brugg » -Direktor Rend Juri . Er soll sich aber noch vor einer Woche gegenüber dem Bundesrat hinsichtlich der in Aussicht genommenen « Massnahmen » befriedigt erklärt haben . So kam es dann , dass in Bern abgeschlossene Wetten , Juri werde trotzdem am Donnerstag an Radio und Fernsehen seiner Enttäuschung über die Nichterfüllung der bäuerlichen Begehren Ausdruck geben , tatsächlich gewonnen wurden . Nun , das gibt es also auch , man kann mit dem Bundesrat , nicht aber mit seinen Entscheiden zufrieden » ein . .., v , . Unter dem Titel « Abwehr von Einkommens- und Beschäftigungseinbrüchen » hegt ein dreiteiliges Massnahmenpaket auf dem Tisch des Bundesrates , das nächste Woche verabschiedet werden soll . Mit Nachtragskrediten von 115 Millionen soll der Investitionstätigkeit ein Impuls gegeben werden . Man rechnet damit , dass diese Nachtragskredite in Kantonen und Gemeinden weitere Investitionen auslösen werden . Ferner ist eine Aenderung des Gesetzes über die Exportrisikogarantie vorgesehen , wobei künftig 97 Prozent des Wertes der exportierten Ware ( bisher 85 Prozent ) abgedeckt wird . In einem weitern dringlichen Bundesbeschluss geht es bei der Arbeitslosenversicherung um die Erhöhung der versicherbaren Tagesverdienste sowie bei der Revision des Beruf sbildungsgesetxes um die Paraphierung von Umschulungsfragen . Ende dieses Monats gibt es keine Kreditzuwachsbegrenzung mehr . Schon verschiedentlich gelockert , trägt die nunmehrige Aufhebung des Kreditbeschlusses der veränderten Wirtschaftslage Rechnung . Im weitern rechtfertigt der abgeschwächte private Konsum auch die Aufhebung der einschränkenden Vorschriften bei den Kleinkreditund Abzahlungsgeschäften . Fraglich bleibt indessen , ob diese Art der Ankur belung des Konsums richtig ist , entsprechen doch cjiepe Vorschriften einem sozialpolitischen Anliegen , vor unüberlegten Kreditkäufen zu schützen . Mindestanzahlung und Höchstdauer von Abzahlungsgeschäften sollten deshalb nicht soweit gelockert werden , dass dadurch das in Revision befindliche Teilzahlungsrecht präjudiziert wird . Das Kernkraftwerk Kaiseraugst erzeugt « Spannung » , noch ehe es gebaut ist . Dem Bundesrat wurde ein Brief überbracht , der von 15 000 Bewohnern der Region unterzeichnet ist . Damit solidarisieren sie sich mit den Besetzern des Baugeländes und fordern mit diesen einen Baustopp , bis alle noch offenen Fragen geklärt sind . Am Samstag , dem 26 . April , wenn die neuen SBB-Tageskarten erstmals gültig sind , haben die Gewaltfreie Aktion Kaiseraugst und die Besetzer zu einer Grosiskundgebung gegen Kernkraftwerke auf dem Bundesplatz in Bern aufgerufen . Von Basel , Zürich und Genf aus sollen Extrazüge organisiert werden . Die Organisatoren erwarten einen Grossaufmarsch , um unter anderem auch gegen die Straffreiheit der Besetzer zu demonstrieren sowie die Landesregierung erneut zu Gesprächen , die nicht an den Verzicht auf die Besetzung von Kaiseraugst geknüpft wird , aufzufordern . Auslandschweizer sollen in einem selbstgewählten politischen Domizil in der Schweiz wählen und dort nach den kantonalen Vorschriften stimmen können . Dies empfiehlt eine Kommission des Nationalrates , die unter dem Vorsitz von Guy Fontanet und im Beisein von Bundesrat Pierre Graber die Botschaft und den Gesetzesentwurf über die politischen Rechte der Auslandschweizer bearbeitet hat . Wie aus einer Mitteilung des Eidgenössischen Politischen Departementes hervorgeht , beantragt die Kommission dem Nationalrat eine Aenderung des Gesetzesentwurfs , wonach Auslandschweizeisich nicht jedesmal in der Gemeinde anmelden müssen , in der sie stimmen wollen . Ein Vorschlag , nur in der Heimatgemeinde stimmen zu können , wurde abgelehnt . . ( dds ) Sitzverteilung Die Tessiner Wahlen vom letzten Wochenende haben die SitzverteiJüng im Kantonsparlament kaum verändert . Als einzige Partei gewann die Partei der Arbeit ( PdA ) 1 Sitz hinzu und verfügt jetzt über 3 Mandate . Diesen Sitz verlor die dissidente freisinnige Arbeitneh * mergruppierung , die sich an den Wahlen nicht mehr beteiligte . Nach den prö < visorischen Resultaten bleibt die Sitz * Verteilung im übrigen unverändert : Freisinn ( Liberal-Radikale ) 35 , Christlichdemokraten 31 , Sozialdemokraten 12 , Autonome Sozialistische Partei 6 , Schweizerische Volkspartei 3 Sitze . ( sda ) Das Konsumentinnenforum der Deutschen Schweiz und des Tessins sowie die Föderation , Romande des Consommatrices rufen alle Konsumenten in der Schweiz zu einetn Fleischstreik auf . Während drei Wochen , vom 25 . April bis zum 15 . Mai , soll auf jeden Fleisch ? einkauf zu einem Preis , der 15 Franken das Kilo übersteigt , verzichtet werden . Mit diesem Teilstreik - heisst es in einem am Donnerstag veröffentlichten Communiqu 6 weiter - könnten die Konsumenten manifestieren , das sie nicht gewillt seien , immer mehr für das Fleisch auszugeben . Mit dem Streikaufruf reagierte das Konsumentinnenforum auf den Beschluss des Bundesrates , die Fleischpreise zu erhöhen , anstatt Massnahmen zu ergreifen , die zu einer Verwertung der Ueberschussproduktion führen könnten , wolle man auf den Konsumenten eine neue Preiserhöhung abwälzen , heisst es in dem Communique weiter . Mit dem Teijstreik solle gegen eine solche , angesichts der heutigen Marktlage « total verfehlte » Agrarpolitik protestiert werden . ( dds ) ;Woche ... v i- • . ¦•¦ ¦ - ¦ . . Aufruf zum Fleischstreik Die Rechte der Auslandschweizer und Fleisch , wo ein Ueberangebot besteht , nur wenig zu < korrigieren . Kräftige Preiskorrekturen gab es indessen beim Ackerbau , die gleichzeitig das Ziel verfolgen , die Milchrechnung zu entlasten und durch eine grössere Ackerfläche den Grad der Selbstversorgung zu erhöhen . Ueber die Preisentscheide ist die Landwirtschaft nicht zufrieden . Nicht zufrieden ist auch « Brugg » -Direktor Rend Juri . Er soll sich aber noch vor einer Woche gegenüber dem Bundesrat hinsichtlich der in Aussicht genommenen « Massnahmen » befriedigt erklärt haben . So kam es dann , dass in Bern abgeschlossene Wetten , Juri werde trotzdem am Donnerstag an Radio und Fernsehen seiner Enttäuschung über die Nichterfüllung der bäuerlichen Begehren Ausdruck geben , tatsächlich gewonnen wurden . Nun , das gibt es also auch , man kann mit dem Bundesrat , nicht aber mit seinen Entscheiden zufrieden » ein . .., v , . Unter dem Titel « Abwehr von Einkommens- und Beschäftigungseinbrüchen » hegt ein dreiteiliges Massnahmenpaket auf dem Tisch des Bundesrates , das nächste Woche verabschiedet werden soll . Mit Nachtragskrediten von 115 Millionen soll der Investitionstätigkeit ein Impuls gegeben werden . Man rechnet damit , dass diese Nachtragskredite in Kantonen und Gemeinden weitere Investitionen auslösen werden . Ferner ist eine Aenderung des Gesetzes über die Exportrisikogarantie vorgesehen , wobei künftig 97 Prozent des Wertes der exportierten Ware ( bisher 85 Prozent ) abgedeckt wird . In einem weitern dringlichen Bundesbeschluss geht es bei der Arbeitslosenversicherung um die Erhöhung der versicherbaren Tagesverdienste sowie bei der Revision des Beruf sbildungsgesetxes um die Paraphierung von Umschulungsfragen . Ende dieses Monats gibt es keine Kreditzuwachsbegrenzung mehr . Schon verschiedentlich gelockert , trägt die nunmehrige Aufhebung des Kreditbeschlusses der veränderten Wirtschaftslage Rechnung . Im weitern rechtfertigt der abgeschwächte private Konsum auch die Aufhebung der einschränkenden Vorschriften bei den Kleinkreditund Abzahlungsgeschäften . Fraglich bleibt indessen , ob diese Art der Ankur belung des Konsums richtig ist , entsprechen doch cjiepe Vorschriften einem sozialpolitischen Anliegen , vor unüberlegten Kreditkäufen zu schützen . Mindestanzahlung und Höchstdauer von Abzahlungsgeschäften sollten deshalb nicht soweit gelockert werden , dass dadurch das in Revision befindliche Teilzahlungsrecht präjudiziert wird . Das Kernkraftwerk Kaiseraugst erzeugt « Spannung » , noch ehe es gebaut ist . Dem Bundesrat wurde ein Brief überbracht , der von 15 000 Bewohnern der Region unterzeichnet ist . Damit solidarisieren sie sich mit den Besetzern des Baugeländes und fordern mit diesen einen Baustopp , bis alle noch offenen Fragen geklärt sind . Am Samstag , dem 26 . April , wenn die neuen SBB-Tageskarten erstmals gültig sind , haben die Gewaltfreie Aktion Kaiseraugst und die Besetzer zu einer Grosiskundgebung gegen Kernkraftwerke auf dem Bundesplatz in Bern aufgerufen . Von Basel , Zürich und Genf aus sollen Extrazüge organisiert werden . Die Organisatoren erwarten einen Grossaufmarsch , um unter anderem auch gegen die Straffreiheit der Besetzer zu demonstrieren sowie die Landesregierung erneut zu Gesprächen , die nicht an den Verzicht auf die Besetzung von Kaiseraugst geknüpft wird , aufzufordern . Auslandschweizer sollen in einem selbstgewählten politischen Domizil in der Schweiz wählen und dort nach den kantonalen Vorschriften stimmen können . Dies empfiehlt eine Kommission des Nationalrates , die unter dem Vorsitz von Guy Fontanet und im Beisein von Bundesrat Pierre Graber die Botschaft und den Gesetzesentwurf über die politischen Rechte der Auslandschweizer bearbeitet hat . Wie aus einer Mitteilung des Eidgenössischen Politischen Departementes hervorgeht , beantragt die Kommission dem Nationalrat eine Aenderung des Gesetzesentwurfs , wonach Auslandschweizeisich nicht jedesmal in der Gemeinde anmelden müssen , in der sie stimmen wollen . Ein Vorschlag , nur in der Heimatgemeinde stimmen zu können , wurde abgelehnt . . ( dds ) Sitzverteilung Die Tessiner Wahlen vom letzten Wochenende haben die SitzverteiJüng im Kantonsparlament kaum verändert . Als einzige Partei gewann die Partei der Arbeit ( PdA ) 1 Sitz hinzu und verfügt jetzt über 3 Mandate . Diesen Sitz verlor die dissidente freisinnige Arbeitneh * mergruppierung , die sich an den Wahlen nicht mehr beteiligte . Nach den prö < visorischen Resultaten bleibt die Sitz * Verteilung im übrigen unverändert : Freisinn ( Liberal-Radikale ) 35 , Christlichdemokraten 31 , Sozialdemokraten 12 , Autonome Sozialistische Partei 6 , Schweizerische Volkspartei 3 Sitze . ( sda ) Das Konsumentinnenforum der Deutschen Schweiz und des Tessins sowie die Föderation , Romande des Consommatrices rufen alle Konsumenten in der Schweiz zu einetn Fleischstreik auf . Während drei Wochen , vom 25 . April bis zum 15 . Mai , soll auf jeden Fleisch ? einkauf zu einem Preis , der 15 Franken das Kilo übersteigt , verzichtet werden . Mit diesem Teilstreik - heisst es in einem am Donnerstag veröffentlichten Communiqu 6 weiter - könnten die Konsumenten manifestieren , das sie nicht gewillt seien , immer mehr für das Fleisch auszugeben . Mit dem Streikaufruf reagierte das Konsumentinnenforum auf den Beschluss des Bundesrates , die Fleischpreise zu erhöhen , anstatt Massnahmen zu ergreifen , die zu einer Verwertung der Ueberschussproduktion führen könnten , wolle man auf den Konsumenten eine neue Preiserhöhung abwälzen , heisst es in dem Communique weiter . Mit dem Teijstreik solle gegen eine solche , angesichts der heutigen Marktlage « total verfehlte » Agrarpolitik protestiert werden . ( dds ) ;884;1975-04-26T00:00:00Z;1975;DTT-1975-04-26-a;2;1;False;CH;Art der Ankur|Guy Fontanet|Pierre Graber;Brugg|Bern|Ware|Bern|Basel|Zürich|Schweiz|Wahlen|Wahlen|Schweiz|Schweiz;OpenPrivate;Migros;y;0.0;local-KSyXZRBU-1UYccjHK;
EXP-1976-09-17-a-i0312;ar;EXP;fr;Les « anti-nucléaires » vont manifester;Les « anti-nucléaires » vont manifester;Les « anti-nucléaires » vont manifester (c) Demain soir, une manifestation d'envergure est préparée par le comité contre Verbois nucléaire, en protestation contre la construction (envisagée) d'un super générateur, à Malville, en France voisine, entre Lyon et Genève. Les adversaires de ce projet dénoncent le danger que présente cette usine bourrée de plutonium. C'est devant le consulat de France de Genève que les manifestants se rendront en force, afin de « demander des cations ». La police interdira l'accès au consultât. Les manifestante annoncent qu'ils tiendront ensuite un grand meeting, à la salle communale de Plainpalais, pour exprimer leur solidarité aux habitants de Seveso (Italie). Mais c'est surtout devant le consulat de France que les choses pourraient s'envenimer... ;Les « anti-nucléaires » vont manifester (c) Demain soir, une manifestation d'envergure est préparée par le comité contre Verbois nucléaire, en protestation contre la construction (envisagée) d'un super générateur, à Malville, en France voisine, entre Lyon et Genève. Les adversaires de ce projet dénoncent le danger que présente cette usine bourrée de plutonium. C'est devant le consulat de France de Genève que les manifestants se rendront en force, afin de « demander des cations ». La police interdira l'accès au consultât. Les manifestante annoncent qu'ils tiendront ensuite un grand meeting, à la salle communale de Plainpalais, pour exprimer leur solidarité aux habitants de Seveso (Italie). Mais c'est surtout devant le consulat de France que les choses pourraient s'envenimer... ;118;1976-09-17T00:00:00Z;1976;EXP-1976-09-17-a;15;1;False;CH;France de Genève;France|Lyon|Genève|France;OpenPrivate;SNL;y;0.0;local-KSyXZRBU-1UYccjHK;
EXP-1983-04-02-a-i0438;ar;EXP;fr;Occupation a Kaiseraugst;Occupation a Kaiseraugst;Occupation a Kaiseraugst KAISERAUGST (AP).-Entre 1500 et 3000 manifestants, selon les estimations, occupent depuis hier après-midi l'aire de construction de la centrale nucléaire de Kaiseraugst (AG) et ont dressé une cinquantaine de tentes. Cette manifestation, organisée par les groupements « Kaiseraugst jamais » et le « Comité de coordination régional contre la centrale nucléaire de Kaiseraugst », devrait se poursuivre jusqu'à lundi. Les forces de police ne sont pas intervenues et la manifestation se déroule dans le calme. ;Occupation a Kaiseraugst KAISERAUGST (AP).-Entre 1500 et 3000 manifestants, selon les estimations, occupent depuis hier après-midi l'aire de construction de la centrale nucléaire de Kaiseraugst (AG) et ont dressé une cinquantaine de tentes. Cette manifestation, organisée par les groupements « Kaiseraugst jamais » et le « Comité de coordination régional contre la centrale nucléaire de Kaiseraugst », devrait se poursuivre jusqu'à lundi. Les forces de police ne sont pas intervenues et la manifestation se déroule dans le calme. ;78;1983-04-02T00:00:00Z;1983;EXP-1983-04-02-a;32;1;False;CH;;;OpenPrivate;SNL;y;0.0;local-KSyXZRBU-1UYccjHK;
EXP-2003-05-12-a-i0285;ar;EXP;fr;Moratoire e nucléaire I ! taxes supplémentaires Le Conseiller fédéral [...];Moratoire e nucléaire I ! taxes supplémentaires Le Conseiller fédéral [...];"Moratoire e nucléaire I taxes supplémentaires Le Conseiller fédéral Moritz Leuenberger a été très clair : qui dit oui au moratoire nucléaire dit oui à de nouvelles taxes. Les initiatives ""Moratoire plus"" et ""Sortir du nucléaire"" augmentent notre dépendance énergétique et la pollution de l'air, menacent notre sécurité d'approvisionnement et entraînent des coûts exorbitants. ";"Moratoire e nucléaire I taxes supplémentaires Le Conseiller fédéral Moritz Leuenberger a été très clair : qui dit oui au moratoire nucléaire dit oui à de nouvelles taxes. Les initiatives ""Moratoire plus"" et ""Sortir du nucléaire"" augmentent notre dépendance énergétique et la pollution de l'air, menacent notre sécurité d'approvisionnement et entraînent des coûts exorbitants. ";54;2003-05-12T00:00:00Z;2003;EXP-2003-05-12-a;27;1;False;CH;Conseiller fédéral Moritz Leuenberger;;OpenPrivate;SNL;y;0.0;local-KSyXZRBU-1UYccjHK;
EXP-2010-05-25-a-i0183;ar;EXP;fr;En marche contre le nucléaire;En marche contre le nucléaire;En marche contre le nucléaire MANIFESTATIONS GÖSGEN Les manifestants étaient résolus mais l’ambiance détendue aux abords de la centrale nucléaire soleuroise. (KEYSTONE) Entre 4000 et 5000 adversaires de l’énergie nucléaire ont manifesté hier à Olten et dans les environs de la centrale de Gösgen (SO). Ils ont pris part à une marche pacifique pour s’opposer à la construction de toute nouvelle centrale en Suisse. Le nucléaire barre le chemin à l’encouragement des énergies renouvelables, a déclaré lors de la manifestation la conseillère nationale Brigit Wyss (Les Verts, SO), qui s’exprimait à Mülidorf, à proximité de la centrale nucléaire de Gösgen. Selon elle, la marche de protestation constitue la première pierre pour sortir du nucléaire. Le conseiller national Fabio Pedrina (PS, TI) se range également du côté des opposants à de nouvelles centrales nucléaires en Suisse. Matteo Buzzi, de Greenpeace Tessin, a rappelé que dans son canton ensoleillé, les conditions cadres étaient très bonnes pour les énergies alternatives. Parmi les manifestants se trouvaient des vétérans du mouvement antinucléaire, mais également de nombreux jeunes gens. La manifestation était conçue pour être accessible aux familles, et s’est déroulée sans incident. / ats ;En marche contre le nucléaire MANIFESTATIONS GÖSGEN Les manifestants étaient résolus mais l’ambiance détendue aux abords de la centrale nucléaire soleuroise. (KEYSTONE) Entre 4000 et 5000 adversaires de l’énergie nucléaire ont manifesté hier à Olten et dans les environs de la centrale de Gösgen (SO). Ils ont pris part à une marche pacifique pour s’opposer à la construction de toute nouvelle centrale en Suisse. Le nucléaire barre le chemin à l’encouragement des énergies renouvelables, a déclaré lors de la manifestation la conseillère nationale Brigit Wyss (Les Verts, SO), qui s’exprimait à Mülidorf, à proximité de la centrale nucléaire de Gösgen. Selon elle, la marche de protestation constitue la première pierre pour sortir du nucléaire. Le conseiller national Fabio Pedrina (PS, TI) se range également du côté des opposants à de nouvelles centrales nucléaires en Suisse. Matteo Buzzi, de Greenpeace Tessin, a rappelé que dans son canton ensoleillé, les conditions cadres étaient très bonnes pour les énergies alternatives. Parmi les manifestants se trouvaient des vétérans du mouvement antinucléaire, mais également de nombreux jeunes gens. La manifestation était conçue pour être accessible aux familles, et s’est déroulée sans incident. / ats ;189;2010-05-25T00:00:00Z;2010;EXP-2010-05-25-a;25;1;False;CH;conseillère nationale Brigit Wyss|conseiller national Fabio Pedrina|Matteo Buzzi;GÖSGEN|Olten|Gösgen|Suisse|Gösgen|Suisse;OpenPrivate;SNL;y;0.0;local-KSyXZRBU-1UYccjHK;
