uid;type;newspaper;language;title;title;content;content;size;date;year;issue;pages;nb_pages;is_on_front;country;persons_mentioned;locations_mentioned;access_right;content_provider;is_content_available;relevance;collections;[total:66,available:100]
FZG-1990-09-08-a-i0071;ar;FZG;de;Ja zur Denkpause in der Energiepolitik;Ja zur Denkpause in der Energiepolitik;"Ja zur Denkpause in der Energiepolitik Automobilist verletzt St . Ursen . Bei einem Zusammenstoss zweier Autos wurde gestern morgen früh ein Automobilist aus Plasselb verletzt und musste ins Kantonsspital gebracht werden . Er fuhr von Rechthalten Richtung St . Ursen . Im Strauss kollidierte sein Fahrzeug seitlich mit einem entgegenkommenden Wagen . Der Sachschaden beträgt 30 000 Franken . Menieres . Gestern mittag kam ein Motorradfahrer aus Lausanne auf einer geraden Strecke zwischen Fetigny und Menieres zu Fall , nachdem er den Strassenrand berührt hatte . Dabei wurde er verletzt und musste ins Spital von Payerne gebracht werden . Die Christlichsoziale Partei ( CSP ) des Kantons Freiburg lud ihre Mitglieder am Donnerstag zu einer Delegiertenversammlung über die Volksabstimmungen von 23 . September ein . Die Versammlung stimmte dem Strassenverkehrs-Referendum , dem Energieartikel und dem Atom-Moratorium zu , lehnte hingegen die Atomausstiegs-Initiative ab . Die kantonalen Dekrete fanden einheitlich Zustimmung . ( go ) Dreimal Ja und einmal Nein für die eidgenössischen ; dreimal Ja fürdie kantonalen Vorlagen : So lauten die Parolen der Christlichsozialen Partei ( CSP ) des Kantons Freiburg für die anstehende Volksabstimmung vom 23 . September . Bei recht massiger Beteiligung von nur knapp dreissig Mitgliedern liessen sich die CSP-Delegierten am Donnerstag in Marly über die verschiedenen Abstimmungsgeschäfte orientieren . Die CSP-Parolen lauten : Ja zum Referendum gegen das Bundesgesetz über den Strassenverkehr ; Ja zum Bundesbeschluss über den Energieartikel ; Ja zur Volksinitiative « Stopp dem Atomkraftwerkbau » ( Moratorium ); Nein zur Volksinitiative für den « Ausstieg aus der Atomenergie » . Die kantonalen Dekrete : Sprachenartikel , Landerwerb und Bau der Gebäude für das Kollegium des Südens sowie das Dekret über die Vergrösserung der Schulen für Krankenpflege wurden alle einstimmig zur Annahme empfohlen . Risiken sind zu gross Weniger Einstimmigkeit herrschte bei der Erläuterung der drei Vorlagen über die Energiepolitik . Um eine breit abgestützte Information sicherzustellen , hatte die CSP für diese drei Themen je einen Vertreter des Pro- respektive Kontra-Komitees eingeladen . Für die drei Energievorlagen äusserte sich An gelika Sekulic , Mitglied des Komitees « 3 mal Ja » . Sie betonte , dass die drei Vorlagen zusammen in der Lage seien , in der Energiepolitik eine Denkpause einzuleiten . Die Risiken der Kernenergie seien , Tschernobyl habe es eindrücklich vor Augen geführt , viel zu gross . Zudem brauche die Wirtschaft offensichtlich noch einen letzten Anstoss , um die Entwicklung alternativer Formen der Energienutzung endlich auf den Punkt zu bringen . Bisher habe das Monopol der Elektrowirtschaft ein solches Umdenken aus Geschäftsinteressen abgeblockt . Der langsame , aber stetige Aufschwung der Solarenergie beispielsweise beweise , dass das Umsatteln auf neue Energieformen möglich sei . Sekulic nannte ein konkretes Beispiel aus der Region : « Vor zwei Jahren hat eine energetische Studie dazu geführt , dass mit der Optimierung der elektrischen Installationen und der Gebäudeisolationen im Kantonsspital in Freiburg eine dreissigprozentige Energieeinsparung verwirklicht werden konnte . » Marktwirtschaft als Lösung Anderer Ansicht waren « ie Vertreter der Gegenseite , Andre Sprenger als französischsprachiger und Peter Siffert als deutschsprachiger Referent . Sie vertraten die Meinung , dass sich die Energiepolitik gemäss der freien Marktwirtschaft regulieren müsse , was erfahrungsgemäss die wirksamste Form der Problemlösung darstelle . Die drei Vorlagen würden in sich das Risiko bergen , dem Staat zu viele Fäden in die Hand zu legen . Auch die Gefahr eines atomaren Unfalls wie in Tschernobyl wurde von den Kontra-Referenten als relativ bezeichnet : « Tschernobyl ist nicht bei uns » , meinte Andre Spreng , dieser Unfall sei auf die mangelhafte Konstruktionstechnologie in den Oststaaten zurückzuführen . Ein weiteres Argument der Gegner war die Abhängigkeit der Schweiz von ausländischen Energiequellen . Die Rechnung gehe nicht auf , betonte Peter Siffert , der Stromverbrauch in der Schweiz steige Jahr für Jahr um 2 Pro zent , 40 Prozent des Strombedarfs würde heute durch AKWs gedeckt . Dieser Anteil könne weder durch alternative Energieformen noch durch vermehrten Stromimport ersetzt werden . Ja zur Gleichberechtigung Indem die Versammlung den Energieartikel und das Atom mora tori um mit 21 zu 4 respektive 15 zu 9 Stimmen zur Annahme empfahl , sprach sie sich für eine Denkpause in der Energiepolitik aus . Die Ausstiegsinitiative aber scheiterte aufgrund ihrer Radikalität mit 16 zu 4 Nein-Stimmen . Nicht zum Scheitern verurteilt waren die drei kantonalen Vorlagen . Bei zwei unter ihnen , dem Sprachenartikel und der Vergrösserung der Schulen für Krankenpflege mit der Schaffung von deutschsprachigen Klassen , zeigte die Versammlung klar , dass ihr die Gleichberechtigung der beiden Freiburger Sprachgemeinschaften ein echtes Anliegen ist . ";"Ja zur Denkpause in der Energiepolitik Automobilist verletzt St . Ursen . Bei einem Zusammenstoss zweier Autos wurde gestern morgen früh ein Automobilist aus Plasselb verletzt und musste ins Kantonsspital gebracht werden . Er fuhr von Rechthalten Richtung St . Ursen . Im Strauss kollidierte sein Fahrzeug seitlich mit einem entgegenkommenden Wagen . Der Sachschaden beträgt 30 000 Franken . Menieres . Gestern mittag kam ein Motorradfahrer aus Lausanne auf einer geraden Strecke zwischen Fetigny und Menieres zu Fall , nachdem er den Strassenrand berührt hatte . Dabei wurde er verletzt und musste ins Spital von Payerne gebracht werden . Die Christlichsoziale Partei ( CSP ) des Kantons Freiburg lud ihre Mitglieder am Donnerstag zu einer Delegiertenversammlung über die Volksabstimmungen von 23 . September ein . Die Versammlung stimmte dem Strassenverkehrs-Referendum , dem Energieartikel und dem Atom-Moratorium zu , lehnte hingegen die Atomausstiegs-Initiative ab . Die kantonalen Dekrete fanden einheitlich Zustimmung . ( go ) Dreimal Ja und einmal Nein für die eidgenössischen ; dreimal Ja fürdie kantonalen Vorlagen : So lauten die Parolen der Christlichsozialen Partei ( CSP ) des Kantons Freiburg für die anstehende Volksabstimmung vom 23 . September . Bei recht massiger Beteiligung von nur knapp dreissig Mitgliedern liessen sich die CSP-Delegierten am Donnerstag in Marly über die verschiedenen Abstimmungsgeschäfte orientieren . Die CSP-Parolen lauten : Ja zum Referendum gegen das Bundesgesetz über den Strassenverkehr ; Ja zum Bundesbeschluss über den Energieartikel ; Ja zur Volksinitiative « Stopp dem Atomkraftwerkbau » ( Moratorium ); Nein zur Volksinitiative für den « Ausstieg aus der Atomenergie » . Die kantonalen Dekrete : Sprachenartikel , Landerwerb und Bau der Gebäude für das Kollegium des Südens sowie das Dekret über die Vergrösserung der Schulen für Krankenpflege wurden alle einstimmig zur Annahme empfohlen . Risiken sind zu gross Weniger Einstimmigkeit herrschte bei der Erläuterung der drei Vorlagen über die Energiepolitik . Um eine breit abgestützte Information sicherzustellen , hatte die CSP für diese drei Themen je einen Vertreter des Pro- respektive Kontra-Komitees eingeladen . Für die drei Energievorlagen äusserte sich An gelika Sekulic , Mitglied des Komitees « 3 mal Ja » . Sie betonte , dass die drei Vorlagen zusammen in der Lage seien , in der Energiepolitik eine Denkpause einzuleiten . Die Risiken der Kernenergie seien , Tschernobyl habe es eindrücklich vor Augen geführt , viel zu gross . Zudem brauche die Wirtschaft offensichtlich noch einen letzten Anstoss , um die Entwicklung alternativer Formen der Energienutzung endlich auf den Punkt zu bringen . Bisher habe das Monopol der Elektrowirtschaft ein solches Umdenken aus Geschäftsinteressen abgeblockt . Der langsame , aber stetige Aufschwung der Solarenergie beispielsweise beweise , dass das Umsatteln auf neue Energieformen möglich sei . Sekulic nannte ein konkretes Beispiel aus der Region : « Vor zwei Jahren hat eine energetische Studie dazu geführt , dass mit der Optimierung der elektrischen Installationen und der Gebäudeisolationen im Kantonsspital in Freiburg eine dreissigprozentige Energieeinsparung verwirklicht werden konnte . » Marktwirtschaft als Lösung Anderer Ansicht waren « ie Vertreter der Gegenseite , Andre Sprenger als französischsprachiger und Peter Siffert als deutschsprachiger Referent . Sie vertraten die Meinung , dass sich die Energiepolitik gemäss der freien Marktwirtschaft regulieren müsse , was erfahrungsgemäss die wirksamste Form der Problemlösung darstelle . Die drei Vorlagen würden in sich das Risiko bergen , dem Staat zu viele Fäden in die Hand zu legen . Auch die Gefahr eines atomaren Unfalls wie in Tschernobyl wurde von den Kontra-Referenten als relativ bezeichnet : « Tschernobyl ist nicht bei uns » , meinte Andre Spreng , dieser Unfall sei auf die mangelhafte Konstruktionstechnologie in den Oststaaten zurückzuführen . Ein weiteres Argument der Gegner war die Abhängigkeit der Schweiz von ausländischen Energiequellen . Die Rechnung gehe nicht auf , betonte Peter Siffert , der Stromverbrauch in der Schweiz steige Jahr für Jahr um 2 Pro zent , 40 Prozent des Strombedarfs würde heute durch AKWs gedeckt . Dieser Anteil könne weder durch alternative Energieformen noch durch vermehrten Stromimport ersetzt werden . Ja zur Gleichberechtigung Indem die Versammlung den Energieartikel und das Atom mora tori um mit 21 zu 4 respektive 15 zu 9 Stimmen zur Annahme empfahl , sprach sie sich für eine Denkpause in der Energiepolitik aus . Die Ausstiegsinitiative aber scheiterte aufgrund ihrer Radikalität mit 16 zu 4 Nein-Stimmen . Nicht zum Scheitern verurteilt waren die drei kantonalen Vorlagen . Bei zwei unter ihnen , dem Sprachenartikel und der Vergrösserung der Schulen für Krankenpflege mit der Schaffung von deutschsprachigen Klassen , zeigte die Versammlung klar , dass ihr die Gleichberechtigung der beiden Freiburger Sprachgemeinschaften ein echtes Anliegen ist . ";760;1990-09-08T00:00:00Z;1990;FZG-1990-09-08-a;10;1;False;CH;Andre Sprenger|Peter Siffert|Andre Spreng|Peter Siffert;Lausanne|Freiburg|Freiburg|Lage|Freiburg|Auch|Schweiz|Schweiz;OpenPrivate;SNL;y;0.0;local-KSyXZRBU-1UYccjHK;
FZG-1990-09-12-a-i0121;ar;FZG;de;Energiesparen ja, aber..,;Energiesparen ja, aber..,;"Energiesparen ja , aber .., Die Sensler Sektionen der CSP , CVP , FDP und SP luden gestern in Schmitten zu einer überparteilichen Podiumsdiskussion ein . Das Podium war den Energievorlagen der Abstimmung vom kommenden 23 . September gewidmet . Fazit : Energiesparen wird grundsätzlich befürwortet ; den bürgerlichen Parteivertreter aber gingen insbesondere die beiden Atom-Initiativen zu weit , wogegeh sich SP und CSP differenziert für diese Vorlagen aussprachen . ( go ) « Wohin mit unserer Energiepolitik ?» lautete die Ausgangsfrage des gestrigen Energiepodiums . Zur Diskussion standen die drei Energievorlagen der Volksabstimmung vom 23 . September : der Bundesbeschluss über den Energieartikel sowie die beiden Volksinitiativen « Ausstieg aus der Atomenergie » und « Stopp dem Atomkraftwerkbau » . Aufdem Podium vor rund 40 Diskussionsteilnehmern standen Josel Catillaz , Präsident der SP-Sense und Befürworter aller drei Energievorla gen ; Peter Jäggi , CSP-Grossrat und pre Atom-Moratorium sowie die beider Gegner der Atominitiativen Pau Schmidhalter , CVP-Nationalrat , unc Kurt Rohrbach vom KKW Mühlenberg . Zu den Vorlagen im einzelnen : Dei Energieartikel verzeichnete unter der Referenten mehrheitlich Zustimmung , obwohl ihn SP-Vertreter Catillaz mit einem « gerupften Huhn , derr die Zähne gezogen worden sind » verglichen hatte . Generell waren sich abei alle Teilnehmer darin einig , das ; Strom gespart werden muss . In dei Diskussion über die Atom-Vorlager aber zeigte sich , dass über die Mittel die zur Erreichung dieses Ziels geeignei wären , die Meinungen stark auseinander gehen . Gegensätzlicher Ansicht waren die beiden Initiativ-Gegner , Rohrbach und Schmidhalter . Ihrer Meinung nach sei Tschernobyl nicht mit dei Schweiz vergleichbar ; könne der Energieverlust durch einen Verzicht aui AKWs nicht mit alternativen Energieträgern wettgemacht werden ; sei das Problem der radioaktiven Abfalle lösbar . ";"Energiesparen ja , aber .., Die Sensler Sektionen der CSP , CVP , FDP und SP luden gestern in Schmitten zu einer überparteilichen Podiumsdiskussion ein . Das Podium war den Energievorlagen der Abstimmung vom kommenden 23 . September gewidmet . Fazit : Energiesparen wird grundsätzlich befürwortet ; den bürgerlichen Parteivertreter aber gingen insbesondere die beiden Atom-Initiativen zu weit , wogegeh sich SP und CSP differenziert für diese Vorlagen aussprachen . ( go ) « Wohin mit unserer Energiepolitik ?» lautete die Ausgangsfrage des gestrigen Energiepodiums . Zur Diskussion standen die drei Energievorlagen der Volksabstimmung vom 23 . September : der Bundesbeschluss über den Energieartikel sowie die beiden Volksinitiativen « Ausstieg aus der Atomenergie » und « Stopp dem Atomkraftwerkbau » . Aufdem Podium vor rund 40 Diskussionsteilnehmern standen Josel Catillaz , Präsident der SP-Sense und Befürworter aller drei Energievorla gen ; Peter Jäggi , CSP-Grossrat und pre Atom-Moratorium sowie die beider Gegner der Atominitiativen Pau Schmidhalter , CVP-Nationalrat , unc Kurt Rohrbach vom KKW Mühlenberg . Zu den Vorlagen im einzelnen : Dei Energieartikel verzeichnete unter der Referenten mehrheitlich Zustimmung , obwohl ihn SP-Vertreter Catillaz mit einem « gerupften Huhn , derr die Zähne gezogen worden sind » verglichen hatte . Generell waren sich abei alle Teilnehmer darin einig , das ; Strom gespart werden muss . In dei Diskussion über die Atom-Vorlager aber zeigte sich , dass über die Mittel die zur Erreichung dieses Ziels geeignei wären , die Meinungen stark auseinander gehen . Gegensätzlicher Ansicht waren die beiden Initiativ-Gegner , Rohrbach und Schmidhalter . Ihrer Meinung nach sei Tschernobyl nicht mit dei Schweiz vergleichbar ; könne der Energieverlust durch einen Verzicht aui AKWs nicht mit alternativen Energieträgern wettgemacht werden ; sei das Problem der radioaktiven Abfalle lösbar . ";290;1990-09-12T00:00:00Z;1990;FZG-1990-09-12-a;13;1;False;CH;Peter Jäggi|Pau Schmidhalter|Kurt Rohrbach;Schweiz;OpenPrivate;SNL;y;0.0;local-KSyXZRBU-1UYccjHK;
FZG-2003-05-10-a-i0042;ar;FZG;de;Reicht der Strom bei einem Atom-Ausstieg...;Reicht der Strom bei einem Atom-Ausstieg...;Reicht der Strom bei einem Atom-Ausstieg ? Effizientere und erneuerbare Enerqien qefor dert Alle fünf Schweizer Kernkraftwerke sollen rasch stillgelegt werden . Das fordert die Volksinitiative « Strom ohne Atom » . Die Gegner weisen auf die Sicherheit und Zuverlässigkeit der einheimischen Anlagen hin . Für sie ist der Ausstieg bis 2014 unrealistisch , ökologisch unverantwortlich und zu teuer . Von WALTER BUCHS Zurzeit werden in der Schweiz fünf Kernkraftwerke ( KKW ) betrieben . Sie produzierten im Durchschnitt der letzten fünf Jahre 37 Prozent der Elektrizität . Aus der einheimischen Wasserkraft stammen knapp 59 Prozent . Die restlichen rund vier Prozent verteilen sich auf Erdgas , Erdöl , Biergas , Wind- und Sonnenenergie und Strom aus der Kehrichtverbrennung . Die Initiative « Strom ohne Atom » fordert nun , dass rasch auf Elektrizität aus Hpn TC TCW vpr 7 irh . pf wird Für eine « Energiewende » Wird die Volksinitiative « Strom ohne Atom - Für eine Energiewende und die schrittweise Stilllegung der Atomkraftwerke » gutgeheissen , müssen in elf Jahren alle fünf KKW stillstehen . Beznau I + II sowie Mühleberg würden spätestens zwei Jahre nach Annahme des Volksbegehrens vom Netz genommen , also 2005 . Gösgen und Leibstadt würden nach 30 Betriebsiahren abge stellt , also 2009 resp . 2014 . Gemäss Initiative hat der Bund weiter dafür zu sorgen , dass die Elektrizitätswerke auf nicht nukleare Energiequellen umstellen . Deshalb wären mit Erdöl oder Erdgas betriebene Kraftwerke nur zulässig , wenn die Abwärme genutzt wird ( Fernwärmenetz ) . Im Weiteren müsste der Bund Vorschriften für eine « dauerhafte Lagerung der in der Schweiz produzierten radioaktiven Abfälle » erlassen . Die betroffenen Kantone und Gemeinden erhielten dabei Mitentscheidungsrechte . Die Wiederaufbereitung abgebrannter Brennstäbe würde verboten . Für die Befürworter geht es darum , rasch auf eine sichere Stromversorgung umzuschalten , das Land « vom atomaren Alptraum zu erlösen » und die Pro duktion von atomarem Abfall zu stoppen . Sie sehen den konsequenten Ausstieg aus der Kernenergie als Beginn einer nachhaltigen Elektrizitätsversorgung und als Chance für die Schweiz , sich als Pionierland zu profilieren . Der Atomstrom könnte nach ihrer Meinung ersetzt und eingespart werden , indem Strom rationeller genutzt werde und die Produktion auf erneuerbare Quellen wie Sonne , Wind , Holz und Biomasse umstelle . Der Ausstieg vermindere die Umweltbelastung , denn mit einer Energielenkungsabgabe könne der CO ,-Ausstoss verringert werden . « Atomausstieg schafft Sicherheit » lautet ein Motto der Initianten . Sie weisen auf die Gefahr einer möglichen Atomkatastrofe hin , die sich nirht nur hpi pinpm Stnrfall im Wprk Bei Annahme der Ausstieqsinitiative wären die Taqes des KKWBenznau I ( Bild ) qezählt . Bild Keystone sondern auch wegen Terrorattentaten oder menschüchen Versagens ( Flugzeugabsturz ) ergeben können . Bewährter Versorgungs-Mix Die Gegner des sofortigen Ausstiegs weisen auf den bewährten Schweizer Strommix aus rund 60 Prozent Wasserund 40 Prozent Kernkraft hin . Ein Einstellen der Schweizer KKW , wie es die Initiative vorsieht , brächte eine Versorgungslücke von rund 25000 Gigawatt stunden . Dabei sei der immer noch steigende Strombedarf nicht inbegriffen . Bereits nach zwei Jahren würden 13 Prozent des einheimischen Stroms wegfallen . Eine Lücke in dieser Grössenordnung könne in so kurzer Zeit nicht mit emeuerbaren Energien gestopft werden . Kurzfristig müssten voraussichtlich Gaskraftwerke gebaut werden . Ein höherer C 0-Ausstoss wäre 2 die Folge . Auch die Auslandabhängigkeit würde notgedrungen zunehmen . Hpr RllndpQrnt cipht Irpinpn ( fi-iind « den Weiterbetrieb von sicher und zuverlässig funktionierenden KKW zu erschweren » . Dies mache volkswirtschaftlich und ökologisch wenig Sinn . Als indirekten Gegenvorschlag zu den Initiativen hat das Parlament im März das Kernenergiegesetz verabschiedet . ;Reicht der Strom bei einem Atom-Ausstieg ? Effizientere und erneuerbare Enerqien qefor dert Alle fünf Schweizer Kernkraftwerke sollen rasch stillgelegt werden . Das fordert die Volksinitiative « Strom ohne Atom » . Die Gegner weisen auf die Sicherheit und Zuverlässigkeit der einheimischen Anlagen hin . Für sie ist der Ausstieg bis 2014 unrealistisch , ökologisch unverantwortlich und zu teuer . Von WALTER BUCHS Zurzeit werden in der Schweiz fünf Kernkraftwerke ( KKW ) betrieben . Sie produzierten im Durchschnitt der letzten fünf Jahre 37 Prozent der Elektrizität . Aus der einheimischen Wasserkraft stammen knapp 59 Prozent . Die restlichen rund vier Prozent verteilen sich auf Erdgas , Erdöl , Biergas , Wind- und Sonnenenergie und Strom aus der Kehrichtverbrennung . Die Initiative « Strom ohne Atom » fordert nun , dass rasch auf Elektrizität aus Hpn TC TCW vpr 7 irh . pf wird Für eine « Energiewende » Wird die Volksinitiative « Strom ohne Atom - Für eine Energiewende und die schrittweise Stilllegung der Atomkraftwerke » gutgeheissen , müssen in elf Jahren alle fünf KKW stillstehen . Beznau I + II sowie Mühleberg würden spätestens zwei Jahre nach Annahme des Volksbegehrens vom Netz genommen , also 2005 . Gösgen und Leibstadt würden nach 30 Betriebsiahren abge stellt , also 2009 resp . 2014 . Gemäss Initiative hat der Bund weiter dafür zu sorgen , dass die Elektrizitätswerke auf nicht nukleare Energiequellen umstellen . Deshalb wären mit Erdöl oder Erdgas betriebene Kraftwerke nur zulässig , wenn die Abwärme genutzt wird ( Fernwärmenetz ) . Im Weiteren müsste der Bund Vorschriften für eine « dauerhafte Lagerung der in der Schweiz produzierten radioaktiven Abfälle » erlassen . Die betroffenen Kantone und Gemeinden erhielten dabei Mitentscheidungsrechte . Die Wiederaufbereitung abgebrannter Brennstäbe würde verboten . Für die Befürworter geht es darum , rasch auf eine sichere Stromversorgung umzuschalten , das Land « vom atomaren Alptraum zu erlösen » und die Pro duktion von atomarem Abfall zu stoppen . Sie sehen den konsequenten Ausstieg aus der Kernenergie als Beginn einer nachhaltigen Elektrizitätsversorgung und als Chance für die Schweiz , sich als Pionierland zu profilieren . Der Atomstrom könnte nach ihrer Meinung ersetzt und eingespart werden , indem Strom rationeller genutzt werde und die Produktion auf erneuerbare Quellen wie Sonne , Wind , Holz und Biomasse umstelle . Der Ausstieg vermindere die Umweltbelastung , denn mit einer Energielenkungsabgabe könne der CO ,-Ausstoss verringert werden . « Atomausstieg schafft Sicherheit » lautet ein Motto der Initianten . Sie weisen auf die Gefahr einer möglichen Atomkatastrofe hin , die sich nirht nur hpi pinpm Stnrfall im Wprk Bei Annahme der Ausstieqsinitiative wären die Taqes des KKWBenznau I ( Bild ) qezählt . Bild Keystone sondern auch wegen Terrorattentaten oder menschüchen Versagens ( Flugzeugabsturz ) ergeben können . Bewährter Versorgungs-Mix Die Gegner des sofortigen Ausstiegs weisen auf den bewährten Schweizer Strommix aus rund 60 Prozent Wasserund 40 Prozent Kernkraft hin . Ein Einstellen der Schweizer KKW , wie es die Initiative vorsieht , brächte eine Versorgungslücke von rund 25000 Gigawatt stunden . Dabei sei der immer noch steigende Strombedarf nicht inbegriffen . Bereits nach zwei Jahren würden 13 Prozent des einheimischen Stroms wegfallen . Eine Lücke in dieser Grössenordnung könne in so kurzer Zeit nicht mit emeuerbaren Energien gestopft werden . Kurzfristig müssten voraussichtlich Gaskraftwerke gebaut werden . Ein höherer C 0-Ausstoss wäre 2 die Folge . Auch die Auslandabhängigkeit würde notgedrungen zunehmen . Hpr RllndpQrnt cipht Irpinpn ( fi-iind « den Weiterbetrieb von sicher und zuverlässig funktionierenden KKW zu erschweren » . Dies mache volkswirtschaftlich und ökologisch wenig Sinn . Als indirekten Gegenvorschlag zu den Initiativen hat das Parlament im März das Kernenergiegesetz verabschiedet . ;607;2003-05-10T00:00:00Z;2003;FZG-2003-05-10-a;9;1;False;CH;WALTER BUCHS;Schweiz|Gösgen|Schweiz|Schweiz|Auch;OpenPrivate;SNL;y;0.0;local-KSyXZRBU-1UYccjHK;
